{
  "id": "m_sample_001",
  "goal": "Publish and market a romantasy novel under Raven Thorne pen name",
  "original_goal": "Publish and market a romantasy novel under Raven Thorne pen name",
  "status": "ACTIVE",
  "created_at": "2026-03-23T10:00:00+00:00",
  "updated_at": "2026-03-23T12:00:00+00:00",
  "kpis": [
    {"metric": "book_published", "target": true, "current": false, "met": false},
    {"metric": "review_count", "target": 10, "current": 0, "met": false}
  ],
  "tasks": [
    {
      "task_id": "abc12345",
      "goal": "Write 50K-word romantasy manuscript",
      "type": "one-time",
      "cadence": null,
      "status": "RUNNING",
      "requires_gpu": false
    },
    {
      "task_id": "def67890",
      "goal": "Generate book cover with SDXL",
      "type": "one-time",
      "cadence": null,
      "status": "CREATED",
      "requires_gpu": true
    },
    {
      "task_id": "ghi11223",
      "goal": "Post promotional content to Reddit",
      "type": "recurring",
      "cadence": "0 9 * * 1,3,5",
      "status": "CREATED",
      "requires_gpu": false
    }
  ],
  "strategy": "Write manuscript first, then cover art, then marketing in parallel with publishing",
  "stall_count": 0,
  "priority": 2
}
